{
  "schemaVersion": "1.0",
  "catalogType": "wines",
  "generatedAt": "2026-08-31T23:30:00Z",
  "items": [
    {
      "id": "wine-cremant-dalsace-brut",
      "kind": "WINE",
      "name": "Crémant d'Alsace Brut",
      "style": "Crémant d'Alsace Brut",
      "isAlcoholic": true,
      "color": "SPARKLING",
      "tastingNotes": [
        "apple",
        "citrus",
        "fine bubbles"
      ],
      "pairingTags": [
        "welcome toast",
        "akara-style fritters",
        "light starters"
      ],
      "courseRoles": [
        "WELCOME",
        "STARTER"
      ],
      "themeConnections": [
        {
          "theme": "IMAGINED_FUTURES",
          "explanation": "A fresh, celebratory pour opens the meal by making room for anticipation, conversation, and collective possibility.",
          "sourceIds": [
            "src-wine-cremant-dalsace-brut"
          ]
        }
      ],
      "sourceRefs": [
        {
          "sourceId": "src-wine-cremant-dalsace-brut",
          "provider": "Vins d'Alsace",
          "title": "The AOC Crémant d'Alsace",
          "url": "https://www.vinsalsace.com/en/gouts-et-couleurs/aoc/aoc-cremant-dalsace/",
          "accessedAt": "2026-08-31T18:29:01Z",
          "attribution": "Style or beverage-reference source. Tasting tags, pairing guidance, and theme connection are original catalog writing.",
          "licenseNote": "No current prices, retail availability, third-party review text, or images are stored in this record."
        }
      ],
      "reviewStatus": "DRAFT",
      "reviewNotes": "The Crémant d'Alsace AOC was established in 1976 and adheres to strict production standards similar to those in Champagne.",
      "country": "France",
      "region": "Alsace",
      "sweetness": "DRY",
      "body": "MEDIUM",
      "acidity": "HIGH",
      "tannin": "NONE",
      "producer": "Generic Alsace Regional Producer",
      "grapes": [
        "pinot blanc",
        "auxerrois",
        "pinot gris",
        "pinot noir",
        "riesling",
        "chardonnay"
      ],
      "alcoholByVolume": 12,
      "servingTemperatureCelsius": 7
    },
    {
      "id": "wine-cava-brut",
      "kind": "WINE",
      "name": "Cava Brut",
      "style": "Cava Brut",
      "isAlcoholic": true,
      "color": "SPARKLING",
      "tastingNotes": [
        "citrus",
        "almond",
        "brisk bubbles"
      ],
      "pairingTags": [
        "welcome toast",
        "spiced plantains",
        "fried starters"
      ],
      "courseRoles": [
        "WELCOME",
        "STARTER"
      ],
      "themeConnections": [
        {
          "theme": "IMAGINED_FUTURES",
          "explanation": "A fresh, celebratory pour opens the meal by making room for anticipation, conversation, and collective possibility.",
          "sourceIds": [
            "src-wine-cava-brut"
          ]
        }
      ],
      "sourceRefs": [
        {
          "sourceId": "src-wine-cava-brut",
          "provider": "D.O. Cava Regulatory Board",
          "title": "Types and varieties of Cava - Differences between the various types of Cava",
          "url": "https://www.cava.wine/en/news-articles/types-and-varieties-of-cava-differences-between-the-various-types-of-cava/",
          "accessedAt": "2026-08-31T10:00:00Z",
          "attribution": "Style or beverage-reference source. Tasting tags, pairing guidance, and theme connection are original catalog writing.",
          "licenseNote": "No current prices, retail availability, third-party review text, or images are stored in this record."
        }
      ],
      "reviewStatus": "DRAFT",
      "reviewNotes": "Specific grape proportions and aging durations may vary significantly between individual producers within the D.O. Cava regulatory framework.",
      "country": "Spain",
      "region": "Penedès",
      "sweetness": "DRY",
      "body": "LIGHT",
      "acidity": "HIGH",
      "tannin": "NONE",
      "producer": "D.O. Cava Regional Producers",
      "grapes": [
        "macabeo",
        "xarel-lo",
        "parellada"
      ],
      "alcoholByVolume": 11.5,
      "servingTemperatureCelsius": 7
    },
    {
      "id": "wine-vinho-verde-branco",
      "kind": "WINE",
      "name": "Vinho Verde Branco",
      "style": "Vinho Verde Branco",
      "isAlcoholic": true,
      "color": "WHITE",
      "tastingNotes": [
        "lime",
        "green apple",
        "light spritz"
      ],
      "pairingTags": [
        "tomato cucumber salad",
        "carrot citrus salad",
        "plantain"
      ],
      "courseRoles": [
        "WELCOME",
        "STARTER"
      ],
      "themeConnections": [
        {
          "theme": "IMAGINED_FUTURES",
          "explanation": "A fresh, celebratory pour opens the meal by making room for anticipation, conversation, and collective possibility.",
          "sourceIds": [
            "src-wine-vinho-verde-branco"
          ]
        }
      ],
      "sourceRefs": [
        {
          "sourceId": "src-wine-vinho-verde-branco",
          "provider": "Wines of Portugal",
          "title": "Vinho Verde",
          "url": "https://winesofportugal.com/en/discover/wine-regions/vinho-verde/",
          "accessedAt": "2026-08-31T18:28:00Z",
          "attribution": "Style or beverage-reference source. Tasting tags, pairing guidance, and theme connection are original catalog writing.",
          "licenseNote": "No current prices, retail availability, third-party review text, or images are stored in this record."
        }
      ],
      "reviewStatus": "DRAFT",
      "reviewNotes": "Traditional styles often feature a slight, natural spritz intended to enhance freshness.",
      "country": "Portugal",
      "region": "Vinho Verde",
      "sweetness": "DRY",
      "body": "LIGHT",
      "acidity": "HIGH",
      "tannin": "NONE",
      "producer": "Various Minho Producers",
      "grapes": [
        "alvarinho",
        "arinto",
        "avesso",
        "azal",
        "loureiro",
        "trajadura"
      ],
      "alcoholByVolume": 10,
      "servingTemperatureCelsius": 9
    },
    {
      "id": "wine-provence-rose",
      "kind": "WINE",
      "name": "Provence Rosé",
      "style": "Provence Rosé",
      "isAlcoholic": true,
      "color": "ROSE",
      "tastingNotes": [
        "white peach",
        "citrus",
        "dry finish"
      ],
      "pairingTags": [
        "carrot citrus salad",
        "tomato cucumber salad",
        "mushroom skewers"
      ],
      "courseRoles": [
        "WELCOME",
        "STARTER"
      ],
      "themeConnections": [
        {
          "theme": "IMAGINED_FUTURES",
          "explanation": "A fresh, celebratory pour opens the meal by making room for anticipation, conversation, and collective possibility.",
          "sourceIds": [
            "src-wine-provence-rose"
          ]
        }
      ],
      "sourceRefs": [
        {
          "sourceId": "src-wine-provence-rose",
          "provider": "Vins de Provence",
          "title": "Tasting Rosé",
          "url": "https://www.vinsdeprovence.com/en/le-rose/la-degustation-du-rose",
          "accessedAt": "2026-08-31T18:30:00Z",
          "attribution": "Style or beverage-reference source. Tasting tags, pairing guidance, and theme connection are original catalog writing.",
          "licenseNote": "No current prices, retail availability, third-party review text, or images are stored in this record."
        }
      ],
      "reviewStatus": "DRAFT",
      "reviewNotes": "The characteristic pale hue of Provence Rosé is achieved through short skin contact or direct pressing rather than blending red and white wines.",
      "country": "France",
      "region": "Provence",
      "sweetness": "DRY",
      "body": "LIGHT",
      "acidity": "HIGH",
      "tannin": "NONE",
      "producer": "Various Vignerons de Provence",
      "grapes": [
        "grenache",
        "cinsault",
        "syrah",
        "mourvèdre",
        "tibouren"
      ],
      "alcoholByVolume": 13,
      "servingTemperatureCelsius": 9
    },
    {
      "id": "wine-muscadet-sevre-et-maine",
      "kind": "WINE",
      "name": "Muscadet Sèvre et Maine",
      "style": "Dry White Wine",
      "isAlcoholic": true,
      "color": "WHITE",
      "tastingNotes": [
        "lemon",
        "saline",
        "subtle lees"
      ],
      "pairingTags": [
        "caribbean pumpkin soup",
        "tomato cucumber salad",
        "lentils"
      ],
      "courseRoles": [
        "STARTER",
        "MAIN"
      ],
      "themeConnections": [
        {
          "theme": "ADAPTATION",
          "explanation": "A regional wine style offers a flexible pairing bridge across vegetable, legume, spice, and grain-centered main dishes.",
          "sourceIds": [
            "src-wine-muscadet-sevre-et-maine"
          ]
        }
      ],
      "sourceRefs": [
        {
          "sourceId": "src-wine-muscadet-sevre-et-maine",
          "provider": "Cellar Tours",
          "title": "Muscadet Wine Region | a Guide by Cellar Tours™",
          "url": "https://www.cellartours.com/france/french-wine-regions/muscadet",
          "accessedAt": "2026-08-31T18:36:09Z",
          "attribution": "Replacement factual or instruction source. Catalog summary, theme connection, and pairing notes are original.",
          "licenseNote": "Content is property of Cellar Tours and is intended for informational and educational use."
        }
      ],
      "reviewStatus": "DRAFT",
      "reviewNotes": "Look for the Sur Lie designation on the label to ensure the traditional textural complexity and freshness associated with the style.",
      "country": "France",
      "region": "Loire Valley",
      "sweetness": "BONE_DRY",
      "body": "LIGHT",
      "acidity": "HIGH",
      "tannin": "NONE",
      "producer": "Muscadet Sèvre et Maine Vignerons",
      "grapes": [
        "melon de bourgogne"
      ],
      "alcoholByVolume": 12,
      "servingTemperatureCelsius": 9
    },
    {